correct_ans,question
X,貨車裝載貨物長度，可以前伸超過車頭 2公尺。,"法規選擇題第129題,貨物裝載(防止掉落或滲漏)"
X,廂式貨車裝載貨物，長寬均可超出車廂 30公分。,"法規選擇題第130題,貨物裝載(防止掉落或滲漏)"
○,框式貨車，除裝載貨物有伸後情形外，車身欄板必須扣牢。,"法規選擇題第131題,貨物裝載(防止掉落或滲漏)"
X,受永遠吊銷、吊扣駕照之處分者，受違規再教育 1個月，即可參加駕照考驗。,"法規選擇題第132題,其他(平交道、強制險、環保駕駛、特殊天候、駕駛道德)"
○,受吊銷、吊扣駕駛執照處分，尚未屆滿限制報考期限者，不得參加駕照考驗。,"法規選擇題第133題,其他(平交道、強制險、環保駕駛、特殊天候、駕駛道德)"
X,受吊銷、吊扣駕照處分，尚未屆滿限制報考期限者，繳罰鍰後即可參加駕照考驗。,"法規選擇題第134題,其他(平交道、強制險、環保駕駛、特殊天候、駕駛道德)"
X,汽車駕駛人在 1年內，違規記點共達 6點以上者，應施以道路交通安全講習。,"法規選擇題第135題,其他(平交道、強制險、環保駕駛、特殊天候、駕駛道德)"
○,體格檢查、體能測驗與筆試及格成績有效保留期限均為 1年。,"法規選擇題第136題,其他(平交道、強制險、環保駕駛、特殊天候、駕駛道德)"
○,汽車右轉彎時，應先顯示前後右邊方向燈，或由駕駛人作左臂向上手掌向右微曲之手勢。,"法規選擇題第137題,轉彎(左右轉、迴轉)"
○,按鳴喇叭，以單響為原則，每次不得超過半秒鐘。,"法規選擇題第138題,其他(平交道、強制險、環保駕駛、特殊天候、駕駛道德)"
○,行經設有彎道、隧道、坡路、狹路、學校、醫院標誌之路段、泥濘或積水道路、 道路施工路段，均應減速慢行，作隨時停車之準備。,"法規選擇題第139題,行駛中應注意事項(保持安全車距、注意前車狀況)"
X,夜間會車，應用遠光燈。,"法規選擇題第140題,正確使用燈光(頭燈、霧燈、方向燈)"
○,聞有消防車、救護車、警備車、工程救險車、毒性化學物質災害事故應變車等之警號時，不論來自何方，均應立即避讓，並不得在後跟隨急駛。,"法規選擇題第141題,行駛中應注意事項(保持安全車距、注意前車狀況)"
X,汽車駕駛人行經多車道之圓環，可以不讓內側車道之車輛先行。,"法規選擇題第142題,路口安全(有號誌路口、無號誌路口、停讓行人)"
X,汽車在雙向二車道行駛時，在劃有分向限制線之路段，可以在該路段駛入對方來車之車道內。,"法規選擇題第143題,行駛中應注意事項(保持安全車距、注意前車狀況)"
○,汽車行駛於雙向二車道，在劃有行車分向線之路段，超車時得駛越，但不能並行競駛。,"法規選擇題第144題,行駛中應注意事項(保持安全車距、注意前車狀況)"
X,行車速度，依速限標誌或標線之規定，無標誌或標線者，行車時速不得超過40公里。但在未劃設車道線、行車分向線或分向限制線之道路，或設有快慢車道分隔線之慢車道，時速不得超過 30公里。,"法規選擇題第145題,行駛中應注意事項(保持安全車距、注意前車狀況)"
○,行車速度，依速限標誌或標線之規定，無標誌或標線者，行車時速不得超過50公里。但在設有快慢車道分隔線之慢車道，時速不得超過40公里。,"法規選擇題第146題,行駛中應注意事項(保持安全車距、注意前車狀況)"
X,汽車行至交通頻繁地區，為了行車安全，可以隨時按鳴喇叭。,"法規選擇題第147題,其他(平交道、強制險、環保駕駛、特殊天候、駕駛道德)"
X,遇幼童專用車、校車、身心障礙者用特製車或教練車，不必禮讓。,"法規選擇題第148題,其他(平交道、強制險、環保駕駛、特殊天候、駕駛道德)"
○,臨時停車，係指停車未滿 3分鐘，並保持立即行駛狀態。,"法規選擇題第149題,其他(平交道、強制險、環保駕駛、特殊天候、駕駛道德)"
○,汽車行駛至交岔路口，其行進轉彎，遇有交通指揮人員之指揮與燈光號誌並用時，以交通指揮人員之指揮為準。,"法規選擇題第150題,路口安全(有號誌路口、無號誌路口、停讓行人)"
○,駕車起駛時，應讓行進中之車輛、行人優先通行。,"法規選擇題第151題,路口安全(有號誌路口、無號誌路口、停讓行人)"
○,行人穿越道是指在道路上以枕木紋或斑馬紋之標線標劃，供行人穿越道路之地方。,"法規選擇題第152題,路口安全(有號誌路口、無號誌路口、停讓行人)"
X,"汽車駕駛人行駛於道路時，以手持方式使用行動電話、電腦或其他相類功能裝置進行撥接、通話、數據通訊或其他有礙駕駛安全之行為者，處新臺幣 1,000元罰鍰。","法規選擇題第153題,禁止不當行為(酒駕、不使用手機、危險駕駛)"
○,駕駛人精神疲勞、疾病或睡眠不足，注意力分散不易集中，不得駕駛車輛。,"法規選擇題第154題,禁止不當行為(酒駕、不使用手機、危險駕駛)"
○,停於路邊之車輛遇有霧靄、雨雪、風沙及晝晦時，均應顯示停車燈光或反光標識。,"法規選擇題第155題,正確使用燈光(頭燈、霧燈、方向燈)"
○,汽車在同一車道行駛時，除擬超越前車外，後車與前車之間，應保持隨時可以煞停之距離。,"法規選擇題第156題,行駛中應注意事項(保持安全車距、注意前車狀況)"
○,在山路行車交會時，靠山壁車輛，應讓道路外緣車優先通過。,"法規選擇題第157題,行駛中應注意事項(保持安全車距、注意前車狀況)"
○,超車時，應顯示左方向燈，並於前車左邊保持半公尺以上之間隔超過，行至安全距離後，再顯示右方向燈駛入原行路線。,"法規選擇題第158題,正確使用燈光(頭燈、霧燈、方向燈)"
○,汽車行至無號誌或號誌故障而無交通指揮人員指揮之交岔路口，未劃分幹、支線道，且車道數相同時，如同為直行車或轉彎車者，左方車應暫停，讓右方車先行。,"法規選擇題第159題,路口安全(有號誌路口、無號誌路口、停讓行人)"
○,計程車在設有停車上客處標誌之路段，應在指定之上客處搭載乘客，不得沿途攬載。,"法規選擇題第160題,其他(平交道、強制險、環保駕駛、特殊天候、駕駛道德)"
X,計程車不得任意拒載乘客，但可以故意繞道行駛。,"法規選擇題第161題,其他(平交道、強制險、環保駕駛、特殊天候、駕駛道德)"
○,行車時行車執照、 駕駛執照及其他法定證件，均須隨身攜帶。,"法規選擇題第162題,其他(平交道、強制險、環保駕駛、特殊天候、駕駛道德)"
X,行車不必攜帶隨車工具。,"法規選擇題第163題,行車檢查(設備、燈光)"
X,行車起駛前進，不必顯示方向燈。,"法規選擇題第164題,正確使用燈光(頭燈、霧燈、方向燈)"
○,執行任務中的消防車、救護車、警備車、工程救險車及毒性化學物質災害事故應變車，行車速度不受規定限制。,"法規選擇題第165題,其他(平交道、強制險、環保駕駛、特殊天候、駕駛道德)"
○,汽車除行駛於單行道外，均應靠右行駛，但遇有特殊情況，必須行駛左側道路時，應減速慢行，並注意前方來車及行人。,"法規選擇題第166題,行駛中應注意事項(保持安全車距、注意前車狀況)"
○,汽車在雙向二車道行駛時，均應在遵行車道內行駛。,"法規選擇題第167題,行駛中應注意事項(保持安全車距、注意前車狀況)"
○,汽車行駛於劃有路面邊線之單行道上，除準備停車或臨時停車外，不得駛出路面邊線。,"法規選擇題第168題,行駛中應注意事項(保持安全車距、注意前車狀況)"
○,執行任務中的消防車、救護車、警備車、工程救險車，在同向二車道以上之道路行駛時，內外側車道均可行駛。,"法規選擇題第169題,其他(平交道、強制險、環保駕駛、特殊天候、駕駛道德)"
○,汽車在同向二車道以上道路行駛，變換車道時，應先顯示燈光或手勢，並須保持安全距離。,"法規選擇題第170題,行駛中應注意事項(保持安全車距、注意前車狀況)"
○,在單ㄧ車道的橋樑上及隧道內，不得會車。,"法規選擇題第171題,禁止不當行為(酒駕、不使用手機、危險駕駛)"
○,汽車行經多車道之圓環，應讓內側車道之車輛先行。,"法規選擇題第172題,轉彎(左右轉、迴轉)"
○,在倒車時，應顯示倒車燈光或手勢後，謹慎緩慢後倒，並應注意其他車輛及行人。,"法規選擇題第173題,行駛中應注意事項(保持安全車距、注意前車狀況)"
○,在同向二車道以上之道路，小型汽車內外側車道均可行駛。但不得任意變換車道行駛。,"法規選擇題第174題,行駛中應注意事項(保持安全車距、注意前車狀況)"
○,由同向二車道，進入一車道時，應讓直行車道之車輛先行。,"法規選擇題第175題,轉彎(左右轉、迴轉)"
○,汽車在同向二車道以上之道路行駛，除準備停車或臨時停車外，不得駛出路面邊線或跨越兩條車道行駛。,"法規選擇題第176題,行駛中應注意事項(保持安全車距、注意前車狀況)"
○,設有左右轉彎專用車道之交岔路口，直行車不得占用轉彎專用車道。,"法規選擇題第177題,轉彎(左右轉、迴轉)"
○,汽車在未劃有分向標線之道路，或鐵路平交道或不良道路交會時，應減速慢行。,"法規選擇題第178題,路口安全(有號誌路口、無號誌路口、停讓行人)"
○,對面有來車，或前行車連貫二輛以上時，不得超車。,"法規選擇題第179題,行駛中應注意事項(保持安全車距、注意前車狀況)"
○,欲超越同一車道之前車時，須先鳴喇叭兩單響或變換燈光一次，俟前車減速靠邊，或以手勢表示允讓後，始得超越。,"法規選擇題第180題,行駛中應注意事項(保持安全車距、注意前車狀況)"
○,前行車駕駛人聞後行車按鳴喇叭，如車前路況無障礙，應即減速靠邊或表示允讓。,"法規選擇題第181題,行駛中應注意事項(保持安全車距、注意前車狀況)"
X,為了緊急事情趕路，可以跟在執行公務的消防車或警備車後面行駛。,"法規選擇題第182題,其他(平交道、強制險、環保駕駛、特殊天候、駕駛道德)"
X,交岔路口有交通指揮人員指揮，又有燈光號誌，應以燈光號誌為準。,"法規選擇題第183題,行駛中應注意事項(保持安全車距、注意前車狀況)"
○,汽車行駛至交岔路口欲左轉彎時，應距交岔路口30公尺前顯示方向燈或手勢，換入內側車道或左轉車道，行至交岔路口中心處左轉，並不得佔用來車車道搶先左轉。,"法規選擇題第184題,轉彎(左右轉、迴轉)"
○,在設有劃分島劃分快慢車道之道路，在慢車道上行駛之車輛，不得左轉。,"法規選擇題第185題,轉彎(左右轉、迴轉)"
X,在設有劃分島劃分快慢車道之道路，在慢車道上行駛之車輛，不得右轉。,"法規選擇題第186題,轉彎(左右轉、迴轉)"
X,在多車道的圓環，應讓外側車道之車輛先行。,"法規選擇題第187題,行駛中應注意事項(保持安全車距、注意前車狀況)"
○,交岔路口，因特殊需要另設有標線、標誌者，應依其指示行車。,"法規選擇題第188題,路口安全(有號誌路口、無號誌路口、停讓行人)"
○,汽車行近行人穿越道前，應減速慢行，在行人穿越道上有人穿越時，應暫停讓行人先行通過。,"法規選擇題第189題,路口安全(有號誌路口、無號誌路口、停讓行人)"
X,在行人穿越道上，有人穿越時，汽車仍可慢行通過。,"法規選擇題第190題,路口安全(有號誌路口、無號誌路口、停讓行人)"
○,行近鐵路平交道遮斷器已開始放下，或看守人表示停止，應即暫停。,"法規選擇題第191題,其他(平交道、強制險、環保駕駛、特殊天候、駕駛道德)"
○,鐵路平交道警鈴未響，閃光號誌未顯示，汽車駕駛人仍應看、聽鐵路兩方確無火車駛來，始得通過。,"法規選擇題第192題,其他(平交道、強制險、環保駕駛、特殊天候、駕駛道德)"
X,汽車通過鐵路平交道，前後兩車間，不必保持距離。,"法規選擇題第193題,其他(平交道、強制險、環保駕駛、特殊天候、駕駛道德)"
○,汽車行駛於實施管制之道路，應遵守各該道路之管制規定行駛。,"法規選擇題第194題,其他(平交道、強制險、環保駕駛、特殊天候、駕駛道德)"
X,汽車經過實施管制之道路隨時均可通行。,"法規選擇題第195題,其他(平交道、強制險、環保駕駛、特殊天候、駕駛道德)"
○,汽車在設有彎道、坡路、狹路、狹橋、隧道標誌之路段或鐵路平交道，不得迴車。,"法規選擇題第196題,轉彎(左右轉、迴轉)"
X,如有相當空間，汽車在任何地方均可迴車。,"法規選擇題第197題,轉彎(左右轉、迴轉)"
○,汽車在設有禁止迴車標誌，劃有分向限制線、禁止超車線、禁止變換車道線之路段，不得迴車。,"法規選擇題第198題,轉彎(左右轉、迴轉)"
○,汽車在禁止左轉路段，不得迴車。,"法規選擇題第199題,轉彎(左右轉、迴轉)"
○,汽車在迴車前，應暫停並顯示左轉燈光或手勢，看清確無來往車輛，並注意行人通過，始得迴轉。,"法規選擇題第200題,轉彎(左右轉、迴轉)"
○,汽車行駛於下坡路段時，不得將引擎熄火，放空檔滑行。,"法規選擇題第201題,禁止不當行為(酒駕、不使用手機、危險駕駛)"
X,為節省汽油，汽車下坡時，可將引擎熄火，放空檔滑行。,"法規選擇題第202題,禁止不當行為(酒駕、不使用手機、危險駕駛)"
○,汽車過渡口時，應依到達先後次序過渡，不得搶先。,"法規選擇題第203題,其他(平交道、強制險、環保駕駛、特殊天候、駕駛道德)"
○,貨車過渡口，其總重量超過渡船規定之重量者須將逾重物卸下，分別渡過。,"法規選擇題第204題,其他(平交道、強制險、環保駕駛、特殊天候、駕駛道德)"
○,汽車夜間在市區道路行駛，如照明清楚時，應用近光燈。,"法規選擇題第205題,行車檢查(設備、燈光)"
X,汽車夜間在市區道路行駛，如照明清楚時，應用遠光燈。,"法規選擇題第206題,行車檢查(設備、燈光)"
○,汽車在設有彎道、狹路、坡路、單行道標誌之路段或鐵路平交道、快車道、大眾捷運系統車輛共用通行交岔路口且為大眾捷運系統車輛導引路線上等危險地帶，不得倒車。但因讓車、停車或起駛有倒車必要者，不在此限。,"法規選擇題第207題,禁止不當行為(酒駕、不使用手機、危險駕駛)"
X,倒車時，應按鳴喇叭 3長聲，警告其他車輛或行人。,"法規選擇題第208題,禁止不當行為(酒駕、不使用手機、危險駕駛)"
○,汽車在機場、車站、碼頭、學校、娛樂、展覽、競技、市場或其他公共場所出、入口及消防栓之前，不得停車。,"法規選擇題第209題,禁止不當行為(酒駕、不使用手機、危險駕駛)"
○,汽車在同一車道行駛時，前車如須減速暫停，駕駛人應預先顯示燈光或手勢告知後車。,"法規選擇題第210題,禁止不當行為(酒駕、不使用手機、危險駕駛)"
○,自用汽車，不得在營業汽車招呼站停車。,"法規選擇題第211題,禁止不當行為(酒駕、不使用手機、危險駕駛)"
○,在顯有妨礙他車通行處所，不得停車。,"法規選擇題第212題,禁止不當行為(酒駕、不使用手機、危險駕駛)"
○,在不得已時，把車停在坡道上，應注意防止車輛滑行。,"法規選擇題第213題,事故預防及處理(預防國道二次事故、急救常識)"
X,汽車在中途發生故障，無法移置於不妨礙交通處所時，如在市區道路，僅閃亮左右方或左方之方向燈即可，無需設置車輛故障標誌。,"法規選擇題第214題,事故預防及處理(預防國道二次事故、急救常識)"
X,汽車發生故障，無法移置於無礙交通場所時，如在市區道路，應按鳴喇叭，以警告他車。,"法規選擇題第215題,事故預防及處理(預防國道二次事故、急救常識)"
○,汽車於行車時速在 40公里之路段發生故障，無法移置於無礙交通之場所，應在車身後方 5-30公尺處之路面上，設置車輛故障標誌。,"法規選擇題第216題,事故預防及處理(預防國道二次事故、急救常識)"
○,夜間將車輛停放在無燈光設備或照明不清之道路時，應顯示停車燈光或反光標識。,"法規選擇題第217題,事故預防及處理(預防國道二次事故、急救常識)"
X,夜間將車輛停放在無燈光設備及照明不清之道路時，亦不必顯示停車燈光或反光標識。,"法規選擇題第218題,事故預防及處理(預防國道二次事故、急救常識)"
○,停車後向外開啟車門時，應注意行人與車輛並讓其先行。,"法規選擇題第219題,事故預防及處理(預防國道二次事故、急救常識)"
○,對汽車停車時間、位置、方式及車種，如公路或警察機關有特別規定時，應按其規定。,"法規選擇題第220題,禁止不當行為(酒駕、不使用手機、危險駕駛)"
○,執行任務之消防車、警備車等，其臨時停車及停車地點不受限制。,"法規選擇題第221題,其他(平交道、強制險、環保駕駛、特殊天候、駕駛道德)"
○,裝載危險物品，除應在車頭及車尾懸掛危險標識外，並應在規定之路線及時間內行駛。,"法規選擇題第222題,貨物裝載(防止掉落或滲漏)"
X,在夜間或有霧靄、雨雪、風沙及晝晦時，把車輛停在路旁，不必顯示停車燈光或反光標識。,"法規選擇題第223題,事故預防及處理(預防國道二次事故、急救常識)"
○,曾犯故意殺人、搶劫、搶奪、強盜、恐嚇取財、擄人勒贖等罪，經判決罪刑確定者，不得辦理計程車駕駛人執業登記。,"法規選擇題第224題,其他(平交道、強制險、環保駕駛、特殊天候、駕駛道德)"
○,在超過時速 40公里之路段，汽車拋錨時，應在車身後方 30-100 公尺之路面上豎立車輛故障標誌。,"法規選擇題第225題,事故預防及處理(預防國道二次事故、急救常識)"
X,自民國96年 2月起以領有大貨車駕照直接晉級考領聯結車駕照者，得駕駛大客車。,"法規選擇題第226題,其他(平交道、強制險、環保駕駛、特殊天候、駕駛道德)"
○,已領有大客車駕駛執照者得駕駛大貨車、代用大客車、大客貨兩用車、曳引車、小型車。,"法規選擇題第227題,其他(平交道、強制險、環保駕駛、特殊天候、駕駛道德)"
○,已領有大貨車駕駛執照者，得駕駛小型車。,"法規選擇題第228題,其他(平交道、強制險、環保駕駛、特殊天候、駕駛道德)"
○,違反處罰條例之受處罰人不服處罰之裁決者，應以原處罰機關為被告，逕向管轄之高等行政法院地方行政訴訟庭提起訴訟。,"法規選擇題第229題,其他(平交道、強制險、環保駕駛、特殊天候、駕駛道德)"
○,持有職業駕駛執照未滿 60歲之駕駛人，應自發照之日起，每滿 3年審驗1次。,"法規選擇題第230題,其他(平交道、強制險、環保駕駛、特殊天候、駕駛道德)"
○,貨車裝載貨物寬度不得超過車身。,"法規選擇題第231題,貨物裝載(防止掉落或滲漏)"
○,廂式貨車裝載貨物不得超出車廂以外。,"法規選擇題第232題,貨物裝載(防止掉落或滲漏)"
○,慢車駕駛人、行人不依規定接受道路交通安全講習者，處以罰鍰。,"法規選擇題第233題,其他(平交道、強制險、環保駕駛、特殊天候、駕駛道德)"
○,汽車駕駛人聞消防車、救護車、警備車、工程救險車、毒性化學物質災害事故應變車之警號不立即避讓或跟隨車後急駛處以罰鍰，並吊銷駕駛執照。,"法規選擇題第234題,其他(平交道、強制險、環保駕駛、特殊天候、駕駛道德)"
○,汽車行駛至交岔路口，欲右轉彎時，應距交岔路口 30公尺前，顯示方向燈或手勢，換入外側車道、右轉車道或慢車道，行至路口後再行右轉。,"法規選擇題第235題,轉彎(左右轉、迴轉)"
○,汽車駕駛人違規肇事致受吊扣駕駛執照處分者，應施以道路交通安全講習。,"法規選擇題第236題,其他(平交道、強制險、環保駕駛、特殊天候、駕駛道德)"
○,道路係指公路、街道、巷弄、廣場、騎樓、走廊或其他供公眾通行之處。,"法規選擇題第237題,其他(平交道、強制險、環保駕駛、特殊天候、駕駛道德)"
○,駕駛人酒精濃度超過規定標準，駕車肇事致人重傷或死亡者，除處罰鍰外，吊銷其駕照，並不得再考領。但符合特定條件，且所受吊銷駕駛執照處分，執行已逾相關規定期間，並依規定完成酒駕防制教育或酒癮治療者，不在此限。,"法規選擇題第238題,禁止不當行為(酒駕、不使用手機、危險駕駛)"
X,"汽車駕駛人拒絕接受酒精濃度測試之檢定者，處新臺幣 30,000 元罰鍰。","法規選擇題第239題,禁止不當行為(酒駕、不使用手機、危險駕駛)"
○,"汽車行駛於非高、快速公路之ㄧ般道路，汽車駕駛人、前座或小型車後座乘客未繫安全帶者，處駕駛人新臺幣 1,500元罰鍰。","法規選擇題第240題,事故預防及處理(預防國道二次事故、急救常識)"
○,"汽車駕駛人於開車時，以手持方式使用行動電話、電腦或其他相類功能裝置進行撥接、通話、數據通訊或其他有礙駕駛安全之行為者，處新臺幣3,000 元罰鍰。","法規選擇題第241題,事故預防及處理(預防國道二次事故、急救常識)"
○,"汽車駕駛人酒後駕車，其酒精濃度超過規定標準者，處新臺幣30,000~120,000 元罰鍰，並當場移置保管該汽車及吊扣其駕駛執照。","法規選擇題第242題,禁止不當行為(酒駕、不使用手機、危險駕駛)"
○,未滿14歲之人違反道路交通管理處罰條例規定，處罰其法定代理人或監護人。,"法規選擇題第243題,事故預防及處理(預防國道二次事故、急救常識)"
○,大型車未依規定裝設行車紀錄器及行車視野輔助系統或行車紀錄器及行車視野輔助系統無法正常運作或不當使用行車紀錄器致無法正確記錄資料者，除罰鍰外，應責令其參加臨時檢驗。,"法規選擇題第244題,注意大型車行駛及轉彎(內輪差、視野死角、不並行)"
○,"持小型車駕照駕駛大型汽車者，汽車所有人及駕駛人各處新臺幣40,000~80,000 元罰鍰，並記該車違規紀錄 1次。","法規選擇題第245題,注意大型車行駛及轉彎(內輪差、視野死角、不並行)"
○,未滿18歲之人，未領有駕駛執照駕駛小型汽車或機車者，除處罰鍰並當場禁止其駕駛外，汽車駕駛人及其法定代理人或監護人，應同時施以道路交通安全講習。,"法規選擇題第246題,禁止不當行為(酒駕、不使用手機、危險駕駛)"
X,"汽車裝載貨物超過核定之總重量，總聯結重量或超過所行駛橋樑規定之載重限制者，除責令改正或當場禁止通行外，不分超載程度一律處汽車所有人新台幣 10,000元罰鍰。","法規選擇題第247題,貨物裝載(防止掉落或滲漏)"
○,駕駛人開車時應按遵行方向行駛，違者除罰鍰外並違規記點。,"法規選擇題第248題,行駛中應注意事項(保持安全車距、注意前車狀況)"
○,駕車行駛於人行道，應處以罰鍰並違規記點。,"法規選擇題第249題,禁止不當行為(酒駕、不使用手機、危險駕駛)"
X,駕駛人為了趕時間而闖紅燈，可以不被記違規點數 3點，只繳罰鍰而已。,"法規選擇題第250題,路口安全(有號誌路口、無號誌路口、停讓行人)"
○,在禁止左轉路段不可以迴車，違者除處罰鍰外並違規記點。,"法規選擇題第251題,轉彎(左右轉、迴轉)"
X,繞行圓環迴車太麻煩，為了方便可以逕行迴車，反正不會被罰款及違規記點。,"法規選擇題第252題,轉彎(左右轉、迴轉)"
○,未經前行車表示允讓靠邊慢行，即行超車，要處以罰鍰。,"法規選擇題第253題,行駛中應注意事項(保持安全車距、注意前車狀況)"
X,汽車駕駛人在 1年內違規記點共達6 點以上，才吊扣駕照1個月，因此可以不遵守交通規則。,"法規選擇題第254題,其他(平交道、強制險、環保駕駛、特殊天候、駕駛道德)"
X,駕駛人酒精濃度超過規定標準駕車，只記違規點數 2點而不罰鍰。,"法規選擇題第255題,禁止不當行為(酒駕、不使用手機、危險駕駛)"
X,違規記點又不登記在駕照上，所以可以不必理會而任意違反交通規則。,"法規選擇題第256題,禁止不當行為(酒駕、不使用手機、危險駕駛)"
